Регион,№,Филиал,Адрес
Кушкупырский р-н,9009,QO'SHKO'PIR,"Кошкопирский р-н, ул Шарофа Рашидова, 27 домПосмотреть на карте ..."
Шаватский р-н,9010,SHOVOT,"Шаватский р-н, ул Марифат, 2 домПосмотреть на карте ..."
Янгибазарский р-н,9011,YANGIBOZOR XORAZM,"Янгибазарский р-н, ул.ШаршараПосмотреть на карте ..."
Янгиарыкский р-н,9012,YANGIARIQ,"Янгиарикский р-н, ул.Аль-Хорезмий, 18а домПосмотреть на карте ..."
Ургенчский р-н,9015,URGANCH TUMAN,ул. Мустақиллик дом 28Посмотреть на карте ...
г.Нукус,9501,NUKUS,ул. Татибаева дом-б/н. 22Посмотреть на карте ...
г.Нукус,9504,NUKUS 26-MKR,"Город Нукус, улица Пиржан Сейтов 1А-дом,44-квПосмотреть на карте ..."
Кунградский р-н,9502,QO'NG'IROT,Беруний. б/н.Посмотреть на карте ...
Кунградский р-н,9514,QO'NG'IROT 2,"Кунгиратский р-н, ул.Нурмухаммедова, дом 61Посмотреть на карте ..."
Берунийский р-н,9503,BERUNIY,35-maktab ro'parasiПосмотреть на карте ...
Берунийский р-н,9515,BERUNIY BOZOR,"Берунийский р-н, ул.КурувчиларПосмотреть на карте ..."
Амударьинский р-н,9505,AMUDARYO,"Амударинский р-н, ул. Тадбиркорлар, 11Посмотреть на карте ..."
Турткульский р-н,9506,TO'RTKO'L,"Торткольский р-н, ул К. Атаниязова, дом 42Посмотреть на карте ..."
Элликкалинский р-н,9507,ELLIK QAL'A,"Эллик Калинский р-н, ул Халклар ДустлигиПосмотреть на карте ..."
Тахиаташский р-н,9509,TAXIATOSH,"Тахиаташский район, улица Камолот, дом 35-АПосмотреть на карте ..."
Ходжейлийский р-н,9510,XO'JAYLI,"Ходжалинский р-н, ул.Тандирчи, дом 32Посмотреть на карте ..."
Чимбайский р-н,9511,CHIMBOY,"Чимбойский р-н, ул.Олтина Босага, дом 63Посмотреть на карте ..."
Кегейлийский р-н,9512,KEGEYLI,"Кегейлинский р-н, ул.Дустлик Гузари, 106-домПосмотреть на карте ..."
Кандикульский р-н,9513,QANLIKO'L,"Канлыкульский район, ул.Дустлик, дом 63Посмотреть на карте ..."
